{
  "schemaVersion": "1",
  "auditId": "AUDIT-TAXKIT-EXAMPLE-001",
  "targetRevision": "exact-git-revision",
  "entries": [
    {
      "findingId": "HE-001",
      "requirementIds": ["HFR-001"],
      "taskIds": ["HFI-001"],
      "owningPaths": ["docs/example.md"],
      "verification": ["Name exact repository-owned commands or procedures."],
      "proof": ["Name the bounded receipt or critical journey."]
    }
  ]
}
