{
  "schemaVersion": "1",
  "auditId": "TAXKIT-STRICT-APPS-IAC-2026-08-13",
  "targetRevision": "fa60c88ccc0429d8eef465d71a624e36c4ca093c",
  "entries": [
    {
      "findingId": "FINDING-001",
      "requirementIds": ["AIR-001", "AIR-004"],
      "taskIds": ["APP-IAC-001", "APP-IAC-004", "APP-IAC-005"],
      "owningPaths": ["tools/docs-deployment/", "docs/architecture/deployment.md", "docs/architecture/testing-and-quality.md"],
      "verification": ["bun run check:docs-deployment:types", "bun run test:docs-deployment", "bun run check:docs-deployment", "bun run verification"],
      "proof": ["docs/documentation-audit/strict-apps-iac/APP-IAC-001-validation.json", "docs/documentation-audit/strict-apps-iac/terminal-audit.json"]
    },
    {
      "findingId": "FINDING-002",
      "requirementIds": ["AIR-002", "AIR-004"],
      "taskIds": ["APP-IAC-002", "APP-IAC-004", "APP-IAC-005"],
      "owningPaths": ["tools/docs-deployment/inventory.runtime.ts", "tools/docs-deployment/orphan-inventory.service.ts", "docs/architecture/deployment.md"],
      "verification": ["bun run check:docs-deployment:types", "bun run test:docs-deployment", "bun run check:runbooks", "bun run verification"],
      "proof": ["docs/documentation-audit/strict-apps-iac/APP-IAC-002-validation.json", "docs/documentation-audit/strict-apps-iac/terminal-audit.json"]
    },
    {
      "findingId": "FINDING-003",
      "requirementIds": ["AIR-003", "AIR-004"],
      "taskIds": ["APP-IAC-003", "APP-IAC-004", "APP-IAC-005"],
      "owningPaths": ["apps/docs/src/lib/runtime-factory.server.ts", "apps/docs/src/server.ts", "apps/docs/README.md", "docs/architecture/frontend.md"],
      "verification": ["bun run --filter=docs test", "bun run --filter=docs test:browser", "bun run --filter=docs test:cloudflare-built", "bun run verification"],
      "proof": ["docs/documentation-audit/strict-apps-iac/APP-IAC-003-validation.json", "docs/documentation-audit/strict-apps-iac/terminal-audit.json"]
    },
    {
      "findingId": "FINDING-004",
      "requirementIds": ["AIR-004", "AIR-005"],
      "taskIds": ["APP-IAC-004", "APP-IAC-005"],
      "owningPaths": ["tools/quality/", "tools/docs-deployment/", "docs/architecture/testing-and-quality.md", "package.json"],
      "verification": ["focused adversarial enforcement tests", "bun run check:docs-deployment", "bun run test:skills", "bun run verification"],
      "proof": ["docs/documentation-audit/strict-apps-iac/APP-IAC-004-validation.json", "docs/documentation-audit/strict-apps-iac/terminal-audit.json"]
    }
  ]
}
