{
  "schemaVersion": "1",
  "auditId": "TAXKIT-HARNESS-FOUNDATION-2026-07-24",
  "targetRevision": "8695c018accf4c4abb7e803c631c5120f90e52b2",
  "entries": [
    {
      "findingId": "HE-001",
      "requirementIds": ["HFR-001", "HFR-006"],
      "taskIds": ["HFI-001", "HFI-004", "HFI-005"],
      "owningPaths": ["docs/documentation-audit/harness-foundation/", "docs/verification/harness-epochs.md", "docs/verification/effectiveness.md"],
      "verification": ["bun run check:harness-governance", "bun run verification", "five retained journey commands", "fresh independent review"],
      "proof": ["docs/documentation-audit/harness-foundation/epoch-validation.json", "docs/documentation-audit/harness-foundation/closeout-validation.json"]
    },
    {
      "findingId": "HE-002",
      "requirementIds": ["HFR-003"],
      "taskIds": ["HFI-002", "HFI-005"],
      "owningPaths": [".agents/skills/docs-maintainer/", "tools/skills/canonical-skill-baseline.json"],
      "verification": ["focused local reference traversal", "focused canonical tree comparison", "bun run test:skills", "bun run check:harness-governance"],
      "proof": ["tools/skills/canonical-skill-baseline.json", "docs/documentation-audit/harness-foundation/closeout-validation.json"]
    },
    {
      "findingId": "HE-003",
      "requirementIds": ["HFR-001", "HFR-004"],
      "taskIds": ["HFI-001", "HFI-003", "HFI-005"],
      "owningPaths": ["docs/verification/repository-harness-profile.json", "docs/documentation-audit/harness-foundation/", "tools/governance/", "package.json"],
      "verification": ["bun run check:harness-governance:types", "bun run test:harness-governance", "bun run check:harness-governance", "bun run verification"],
      "proof": ["docs/documentation-audit/harness-foundation/HFI-003-validation.json", "docs/documentation-audit/harness-foundation/closeout-validation.json"]
    },
    {
      "findingId": "HE-004",
      "requirementIds": ["HFR-002", "HFR-003", "HFR-005"],
      "taskIds": ["HFI-002", "HFI-003", "HFI-005"],
      "owningPaths": [".agents/skills/", ".claude/skills/", "tools/skills/canonical-skill-baseline.json", "tools/governance/"],
      "verification": ["focused tree and receipt recomputation", "focused relative-link validation", "bun run test:skills", "bun run check:harness-governance", "bun run verification"],
      "proof": ["tools/skills/canonical-skill-baseline.json", "docs/documentation-audit/harness-foundation/HFI-003-validation.json", "docs/documentation-audit/harness-foundation/closeout-validation.json"]
    }
  ]
}
